{
  "$schema": "http://json-schema.org/draft-07/schema#",
  "$id": "https://papercoach.app/schema/tutorial.schema.json",
  "title": "Paper Coach Tutorial",
  "description": "A stroke-by-stroke drawing tutorial. Shared verbatim with the iOS player: both apps must accept exactly the same documents.",
  "type": "object",
  "additionalProperties": false,
  "required": ["schemaVersion", "id", "title", "canvas", "steps"],
  "properties": {
    "schemaVersion": {
      "description": "Format version. Only 1 exists.",
      "const": 1
    },
    "id": {
      "description": "Stable identifier, unique within a tutorial library.",
      "type": "string",
      "minLength": 1
    },
    "title": {
      "description": "Human-readable name of the whole drawing.",
      "type": "string",
      "minLength": 1
    },
    "canvas": { "$ref": "#/definitions/canvas" },
    "style": { "$ref": "#/definitions/style" },
    "steps": {
      "description": "Ordered steps. The player pauses after each one.",
      "type": "array",
      "minItems": 1,
      "items": { "$ref": "#/definitions/step" }
    }
  },
  "definitions": {
    "canvas": {
      "description": "Coordinate space for every stroke coordinate and line width. Maps directly to the SVG viewBox.",
      "type": "object",
      "additionalProperties": false,
      "required": ["width", "height"],
      "properties": {
        "width": { "type": "number", "exclusiveMinimum": 0 },
        "height": { "type": "number", "exclusiveMinimum": 0 }
      }
    },
    "style": {
      "description": "Optional palette. Defaults are #2B2B2B on #FAF7F0.",
      "type": "object",
      "additionalProperties": false,
      "properties": {
        "strokeColor": { "$ref": "#/definitions/color" },
        "backgroundColor": { "$ref": "#/definitions/color" }
      }
    },
    "color": {
      "description": "Hex colour. Matches what the iOS Color(hex:) initialiser accepts: #RRGGBB or #RRGGBBAA, with the leading # optional. Three-digit #RGB is NOT accepted, because iOS would silently fall back to the default instead of drawing it.",
      "type": "string",
      "pattern": "^#?([0-9a-fA-F]{6}|[0-9a-fA-F]{8})$"
    },
    "step": {
      "type": "object",
      "additionalProperties": false,
      "required": ["id", "title", "instruction", "strokes"],
      "properties": {
        "id": { "type": "string", "minLength": 1 },
        "title": { "type": "string", "minLength": 1 },
        "instruction": {
          "description": "Shown to the child while they copy the step onto paper.",
          "type": "string",
          "minLength": 1
        },
        "voiceover": {
          "description": "Reserved for a future version. Always null in v1; players ignore it.",
          "type": ["string", "null"]
        },
        "strokes": {
          "description": "Drawn strictly in order; stroke N+1 starts when N finishes.",
          "type": "array",
          "minItems": 1,
          "items": { "$ref": "#/definitions/stroke" }
        }
      }
    },
    "stroke": {
      "type": "object",
      "additionalProperties": false,
      "required": ["d", "duration", "lineWidth"],
      "properties": {
        "d": {
          "description": "SVG path data, absolute M/L/C/Q/Z only.",
          "type": "string",
          "minLength": 1
        },
        "duration": {
          "description": "Seconds to draw this stroke at 1x speed.",
          "type": "number",
          "exclusiveMinimum": 0
        },
        "lineWidth": {
          "description": "Stroke width in canvas units.",
          "type": "number",
          "exclusiveMinimum": 0
        }
      }
    }
  }
}
