{
  "schemaVersion": 1,
  "id": "coconut-palm",
  "title": "Coconut Palm",
  "canvas": { "width": 1000, "height": 1000 },
  "steps": [
    {
      "id": "front-coconuts",
      "title": "Draw the two front coconuts",
      "instruction": "A little above the middle of the page and slightly left of centre, draw one round coconut, then a second just below it and a touch to the right, so the two almost touch. Their size sets the scale for the whole tree.",
      "voiceover": null,
      "strokes": [
        {
          "d": "M 473 366 C 459 366 447 378 447 392 C 447 406 459 418 473 418 C 487 418 499 406 499 392 C 499 378 487 366 473 366",
          "duration": 0.8,
          "lineWidth": 10
        },
        {
          "d": "M 484 418 C 470 418 458 430 458 444 C 458 458 470 470 484 470 C 498 470 510 458 510 444 C 510 430 498 418 484 418",
          "duration": 0.8,
          "lineWidth": 10
        }
      ]
    },
    {
      "id": "back-coconuts",
      "title": "Tuck four more behind them",
      "instruction": "Add the coconuts that sit behind: one to the upper right, one beyond it, one on the left and one hanging below. Draw only the part you can see, stopping each line where it meets a coconut already on the page.",
      "voiceover": null,
      "strokes": [
        {
          "d": "M 498 383 C 500 371 511 362 524 363 C 536 364 546 374 547 386 C 548 398 540 410 527 412 C 515 415 503 408 499 397",
          "duration": 0.7,
          "lineWidth": 10
        },
        {
          "d": "M 547 392 C 557 389 567 394 572 402 C 577 411 576 422 569 429 C 563 437 552 439 543 435 C 534 431 528 422 529 412",
          "duration": 0.6,
          "lineWidth": 10
        },
        {
          "d": "M 458 446 C 451 455 439 457 430 453 C 420 448 415 436 418 426 C 421 415 431 408 441 409 C 452 410 461 418 463 429",
          "duration": 0.6,
          "lineWidth": 10
        },
        {
          "d": "M 485 470 C 494 478 497 491 491 501 C 485 512 473 516 461 513 C 450 509 443 498 444 486 C 446 474 455 465 467 464",
          "duration": 0.7,
          "lineWidth": 10
        }
      ]
    },
    {
      "id": "trunk",
      "title": "Draw the curving trunk",
      "instruction": "From under the coconuts, draw the left edge of the trunk down to the ground: it bows out to the right, then sweeps back to the left at the foot. Draw the right edge beside it, a little narrower than a coconut at the top and flaring slightly at the base.",
      "voiceover": null,
      "strokes": [
        {
          "d": "M 505 459 C 520 530 522 640 502 700 C 490 735 472 757 448 770",
          "duration": 1.7,
          "lineWidth": 14
        },
        {
          "d": "M 542 435 C 561 520 564 640 548 700 C 541 730 536 752 532 769",
          "duration": 1.7,
          "lineWidth": 14
        }
      ]
    },
    {
      "id": "upper-fronds",
      "title": "Sweep the three upper fronds",
      "instruction": "Start each line just above the coconuts. Draw one frond rising up and to the left, one arching out to the left and one arching out to the right, its tip a little higher than the left one. One smooth sweep each: these are the spines the leaves will hang from.",
      "voiceover": null,
      "strokes": [
        {
          "d": "M 494 340 C 482 285 440 215 378 170",
          "duration": 1,
          "lineWidth": 13
        },
        {
          "d": "M 487 340 C 440 268 330 222 244 264",
          "duration": 1.4,
          "lineWidth": 13
        },
        {
          "d": "M 501 340 C 548 262 640 198 712 214",
          "duration": 1.3,
          "lineWidth": 13
        }
      ]
    },
    {
      "id": "drooping-fronds",
      "title": "Add four drooping fronds",
      "instruction": "From the same spot, draw two wide arcs that rise a little, reach past the upper fronds and fall at the ends. Then two shorter ones that pass over the coconuts and curl down beside the trunk, ending about level with its middle.",
      "voiceover": null,
      "strokes": [
        {
          "d": "M 484 346 C 400 306 282 330 250 458",
          "duration": 1.5,
          "lineWidth": 13
        },
        {
          "d": "M 506 346 C 590 300 712 322 758 430",
          "duration": 1.5,
          "lineWidth": 13
        },
        {
          "d": "M 480 350 C 416 338 364 436 376 594",
          "duration": 1.5,
          "lineWidth": 13
        },
        {
          "d": "M 510 350 C 584 338 638 440 624 592",
          "duration": 1.5,
          "lineWidth": 13
        }
      ]
    },
    {
      "id": "upper-leaves",
      "title": "Hang leaves from the upper fronds",
      "instruction": "Draw each frond’s leaves as one continuous zigzag: hanging under the two arching fronds, and fanning out from the right side of the upright one. Keep them short near the centre, longest in the middle and short again near the tip.",
      "voiceover": null,
      "strokes": [
        {
          "d": "M 472 280 Q 487 289 502 282 Q 481 276 460 260 Q 480 271 499 263 Q 473 257 447 241 Q 471 253 494 244 Q 464 240 433 222 Q 454 232 475 221 Q 446 219 417 205 Q 436 212 455 202 Q 427 200 400 188 Q 414 192 428 182 Q 405 182 383 173",
          "duration": 2.8,
          "lineWidth": 9
        },
        {
          "d": "M 435 287 Q 414 311 394 316 Q 402 300 411 273 Q 388 307 365 317 Q 375 296 385 261 Q 362 303 338 317 Q 348 293 359 253 Q 337 299 315 317 Q 324 292 332 249 Q 315 290 298 306 Q 301 284 305 248 Q 291 288 277 304 Q 277 285 277 252 Q 267 285 257 299 Q 254 285 250 261",
          "duration": 4,
          "lineWidth": 9
        },
        {
          "d": "M 545 284 Q 568 308 591 312 Q 577 296 563 267 Q 590 298 616 304 Q 600 285 584 251 Q 609 283 634 291 Q 620 271 606 236 Q 633 279 660 292 Q 645 267 629 225 Q 654 268 678 282 Q 666 258 653 217 Q 672 254 692 268 Q 685 247 678 212 Q 693 244 707 257 Q 706 241 704 213",
          "duration": 4,
          "lineWidth": 9
        }
      ]
    },
    {
      "id": "drooping-leaves",
      "title": "Hang leaves from the drooping fronds",
      "instruction": "Do the same on the four drooping fronds: under the two wide arcs, and on the outer side of the two short ones so the leaves stay clear of the coconuts. Even spacing matters more than the number of leaves.",
      "voiceover": null,
      "strokes": [
        {
          "d": "M 419 329 Q 404 364 388 378 Q 390 360 391 329 Q 377 372 363 390 Q 363 369 364 334 Q 352 388 341 413 Q 339 387 337 343 Q 330 398 323 423 Q 318 399 314 357 Q 311 414 309 440 Q 301 417 292 376 Q 295 430 297 456 Q 286 436 275 399 Q 280 445 286 467 Q 274 453 261 424 Q 269 465 277 485 Q 264 474 252 450",
          "duration": 4,
          "lineWidth": 9
        },
        {
          "d": "M 569 325 Q 586 361 603 375 Q 600 356 597 323 Q 614 372 631 392 Q 628 367 625 326 Q 639 379 654 402 Q 653 376 652 332 Q 663 391 674 417 Q 676 390 678 342 Q 684 401 691 428 Q 696 402 702 357 Q 704 415 706 442 Q 715 418 723 376 Q 722 426 720 450 Q 731 432 741 399 Q 737 439 734 459 Q 744 447 754 422",
          "duration": 4,
          "lineWidth": 9
        },
        {
          "d": "M 405 397 Q 383 430 362 443 Q 377 441 392 427 Q 369 468 346 484 Q 365 478 384 457 Q 362 502 340 522 Q 359 513 378 489 Q 359 534 339 555 Q 357 545 375 521 Q 360 560 345 579 Q 360 573 374 555 Q 364 587 353 604 Q 364 600 376 587",
          "duration": 3.3,
          "lineWidth": 9
        },
        {
          "d": "M 591 393 Q 611 421 631 433 Q 619 433 606 423 Q 626 457 647 472 Q 631 469 616 454 Q 638 497 660 517 Q 641 509 622 487 Q 641 528 659 547 Q 642 540 625 519 Q 642 561 658 581 Q 642 573 626 552 Q 637 585 648 601 Q 636 598 625 585",
          "duration": 3.1,
          "lineWidth": 9
        }
      ]
    },
    {
      "id": "bark",
      "title": "Notch the bark",
      "instruction": "Add four short curved marks across the trunk, spaced evenly from the coconuts to the ground. Start each at the left edge and stop before the right one, so the trunk still reads as round.",
      "voiceover": null,
      "strokes": [
        {
          "d": "M 518 521 Q 531 532 544 527",
          "duration": 0.6,
          "lineWidth": 9
        },
        {
          "d": "M 520 586 Q 533 597 547 592",
          "duration": 0.6,
          "lineWidth": 9
        },
        {
          "d": "M 516 646 Q 530 657 544 652",
          "duration": 0.6,
          "lineWidth": 9
        },
        {
          "d": "M 501 706 Q 517 717 533 712",
          "duration": 0.6,
          "lineWidth": 9
        }
      ]
    },
    {
      "id": "sand",
      "title": "Set it on a mound of sand",
      "instruction": "Draw the top of the mound in two parts, stopping at the trunk on each side, then a longer, flatter curve underneath. Make the mound about as wide as the two wide fronds.",
      "voiceover": null,
      "strokes": [
        {
          "d": "M 268 790 C 318 772 392 764 446 768",
          "duration": 0.9,
          "lineWidth": 12
        },
        {
          "d": "M 534 767 C 600 763 690 766 752 784",
          "duration": 1.1,
          "lineWidth": 12
        },
        {
          "d": "M 318 812 C 420 834 600 836 704 812",
          "duration": 1.9,
          "lineWidth": 11
        }
      ]
    }
  ]
}
