{
  "schemaVersion": 1,
  "id": "palm-tree",
  "title": "Palm Tree",
  "canvas": { "width": 1000, "height": 1000 },
  "steps": [
    {
      "id": "trunk",
      "title": "Draw the trunk",
      "instruction": "Draw two curving upright lines that flare slightly outward at the bottom. Notice how the trunk curves gently toward the left before rising vertically.",
      "voiceover": null,
      "strokes": [
        {
          "d": "M 445 765 C 470 730 495 640 500 480 C 502 460 505 440 510 425",
          "duration": 1.9,
          "lineWidth": 14
        },
        {
          "d": "M 500 775 C 530 740 550 645 545 490 C 543 455 540 435 530 420",
          "duration": 1.9,
          "lineWidth": 14
        }
      ]
    },
    {
      "id": "coconuts",
      "title": "Add the coconuts",
      "instruction": "Draw a cluster of rounded oval shapes sitting right at the top of the trunk. Let them overlap each other slightly.",
      "voiceover": null,
      "strokes": [
        {
          "d": "M 460 395 C 450 365 480 350 495 375 C 510 400 495 435 470 430 C 455 425 450 405 460 395 Z",
          "duration": 1.4,
          "lineWidth": 13
        },
        {
          "d": "M 495 375 C 515 360 540 375 540 400 C 540 425 515 435 500 420",
          "duration": 1.1,
          "lineWidth": 13
        },
        {
          "d": "M 460 415 C 430 420 415 455 430 475 C 445 495 470 495 480 475 C 490 455 475 420 460 415 Z",
          "duration": 1.5,
          "lineWidth": 13
        },
        {
          "d": "M 480 430 C 495 420 515 430 515 450 C 515 470 490 485 470 475",
          "duration": 1.2,
          "lineWidth": 13
        },
        {
          "d": "M 525 405 C 545 395 570 410 570 430 C 570 445 550 455 530 445",
          "duration": 1,
          "lineWidth": 12
        }
      ]
    },
    {
      "id": "top-fronds",
      "title": "Draw the top fronds",
      "instruction": "Draw the central and upper fronds arching upward and then feathering back down with saw-toothed outer edges.",
      "voiceover": null,
      "strokes": [
        {
          "d": "M 470 330 C 440 260 400 200 435 180 C 450 200 460 230 480 255 C 485 240 500 255 490 280 C 495 300 485 330 475 350",
          "duration": 2.2,
          "lineWidth": 13
        },
        {
          "d": "M 495 340 C 520 280 570 200 705 215 C 685 240 660 245 660 255 C 675 260 635 285 625 290 C 600 305 565 315 540 330",
          "duration": 2.4,
          "lineWidth": 13
        },
        {
          "d": "M 480 340 C 420 290 340 240 245 270 C 270 285 305 295 300 310 C 285 315 330 335 365 335 C 400 335 440 345 460 365",
          "duration": 2.2,
          "lineWidth": 13
        }
      ]
    },
    {
      "id": "side-fronds",
      "title": "Draw the lower fronds",
      "instruction": "Add the lower fronds drooping outward to the left and right, framing the coconuts with sharp, rhythmic leaf points.",
      "voiceover": null,
      "strokes": [
        {
          "d": "M 450 365 C 380 330 290 360 250 465 C 270 450 295 415 310 430 C 315 400 345 405 350 425 C 365 390 400 400 415 410",
          "duration": 2.2,
          "lineWidth": 13
        },
        {
          "d": "M 410 410 C 370 420 360 500 380 595 C 390 565 410 530 405 505 C 415 515 435 480 430 465 C 440 450 450 435 450 420",
          "duration": 2,
          "lineWidth": 13
        },
        {
          "d": "M 520 355 C 590 320 685 320 755 435 C 725 415 690 405 680 425 C 670 385 645 400 635 420 C 615 385 580 385 555 385",
          "duration": 2.3,
          "lineWidth": 13
        },
        {
          "d": "M 545 385 C 590 410 630 450 635 590 C 625 560 610 525 615 490 C 600 500 585 455 585 440 C 575 435 560 420 545 415",
          "duration": 2,
          "lineWidth": 13
        }
      ]
    },
    {
      "id": "trunk-details-and-ground",
      "title": "Add trunk rings and the ground",
      "instruction": "Finish the drawing with gentle curved rings across the trunk and a low horizontal mound beneath the base to plant the tree firmly.",
      "voiceover": null,
      "strokes": [
        {
          "d": "M 505 470 Q 525 475 543 470",
          "duration": 0.6,
          "lineWidth": 10
        },
        {
          "d": "M 502 520 Q 525 528 546 520",
          "duration": 0.6,
          "lineWidth": 10
        },
        {
          "d": "M 498 575 Q 520 585 546 575",
          "duration": 0.6,
          "lineWidth": 10
        },
        {
          "d": "M 488 640 Q 515 650 544 640",
          "duration": 0.6,
          "lineWidth": 10
        },
        {
          "d": "M 470 705 Q 500 715 533 700",
          "duration": 0.7,
          "lineWidth": 10
        },
        {
          "d": "M 445 765 Q 480 775 505 770",
          "duration": 0.6,
          "lineWidth": 10
        },
        {
          "d": "M 265 785 C 380 760 620 760 745 785",
          "duration": 1.6,
          "lineWidth": 12
        },
        {
          "d": "M 320 805 C 420 825 570 825 675 800",
          "duration": 1.4,
          "lineWidth": 11
        }
      ]
    }
  ]
}
