{
  "schemaVersion": 1,
  "id": "cat-face",
  "title": "Cat Face",
  "canvas": { "width": 1000, "height": 1000 },
  "style": {
    "strokeColor": "#2B2B2B",
    "backgroundColor": "#FAF7F0"
  },
  "steps": [
    {
      "id": "head",
      "title": "Draw the head",
      "instruction": "Draw one big round circle in the middle of your paper. Go slowly and try to make it nice and round.",
      "voiceover": null,
      "strokes": [
        {
          "d": "M 500 240 C 655 240 780 365 780 520 C 780 675 655 800 500 800 C 345 800 220 675 220 520 C 220 365 345 240 500 240 Z",
          "duration": 3.2,
          "lineWidth": 16
        }
      ]
    },
    {
      "id": "left-ear",
      "title": "Add the left ear",
      "instruction": "Draw a pointy triangle on the top left of the circle. That is the first ear.",
      "voiceover": null,
      "strokes": [
        {
          "d": "M 302 322 L 270 110 L 460 248",
          "duration": 1.5,
          "lineWidth": 16
        }
      ]
    },
    {
      "id": "right-ear",
      "title": "Add the right ear",
      "instruction": "Now draw the same pointy triangle on the top right. Try to make both ears the same size.",
      "voiceover": null,
      "strokes": [
        {
          "d": "M 698 322 L 730 110 L 540 248",
          "duration": 1.5,
          "lineWidth": 16
        }
      ]
    },
    {
      "id": "eyes",
      "title": "Draw two eyes",
      "instruction": "Draw two small circles for the eyes. Put them side by side in the middle of the face.",
      "voiceover": null,
      "strokes": [
        {
          "d": "M 400 432 C 421 432 438 449 438 470 C 438 491 421 508 400 508 C 379 508 362 491 362 470 C 362 449 379 432 400 432 Z",
          "duration": 1.4,
          "lineWidth": 12
        },
        {
          "d": "M 600 432 C 621 432 638 449 638 470 C 638 491 621 508 600 508 C 579 508 562 491 562 470 C 562 449 579 432 600 432 Z",
          "duration": 1.4,
          "lineWidth": 12
        }
      ]
    },
    {
      "id": "nose-mouth",
      "title": "Nose and smile",
      "instruction": "Draw a tiny triangle for the nose. Then draw a short line down and two curves out to the sides to make a smile.",
      "voiceover": null,
      "strokes": [
        {
          "d": "M 470 590 L 530 590 L 500 625 Z",
          "duration": 1.1,
          "lineWidth": 12
        },
        {
          "d": "M 500 625 L 500 652",
          "duration": 0.6,
          "lineWidth": 12
        },
        {
          "d": "M 500 652 Q 455 702 410 655",
          "duration": 0.9,
          "lineWidth": 12
        },
        {
          "d": "M 500 652 Q 545 702 590 655",
          "duration": 0.9,
          "lineWidth": 12
        }
      ]
    },
    {
      "id": "whiskers",
      "title": "Last, the whiskers",
      "instruction": "Draw three straight lines going out from each cheek. Now your cat is finished!",
      "voiceover": null,
      "strokes": [
        {
          "d": "M 240 600 L 60 555 M 248 640 L 45 640 M 272 680 L 70 725",
          "duration": 1.8,
          "lineWidth": 10
        },
        {
          "d": "M 760 600 L 940 555 M 752 640 L 955 640 M 728 680 L 930 725",
          "duration": 1.8,
          "lineWidth": 10
        }
      ]
    }
  ]
}
